teacher ,student,fluency"You know multiple overfittings?,Okay,explain one of them.
","No, no sir.
If we take KNN classification and we have, if the k value is tinier so,all of the,I mean all of the attributes will try to align itself to that one class.
So, that will be overfitting.
Most of the attributes are trying to align.
The model itself is trying to align to one of the parameters.
Whereas underfitting is when there are lots of parameters, then the model does not know, it cannot quite categorize where it should be.
So, it won't be able to throw the right answer.

",Low"So, you want regression or KNN?","So, overfitting in general,means that, 
",Medium"You take any model and explain overfitting there.
","Yes.Okay sir.
Sir, regression, I am not able to answer properly.
So, in KNN classification when K value is smaller, we will have only one neighbor.
So, in that case, only the, it will assign, so all of the values, let's say a model is asking for dog or cat.
The majority class will be dog.
So, in that case, even if a cat is supposed to be assigned as a cat, it will align itself to the majority class itself and give the wrong prediction.
",Medium"But, you have small where is majority?
","Sir, like K is equal to one means it will give you only,
",LowThere is no majority.,"It will give only dog as the prediction.
That will lead to overfitting.",Medium"It won't put every cat into dog, na?","No, sir.
But, like it will only throw a dog as an output essentially.
",Low"Why?
","That, because it will be, it's overfit to such a model that it can only recognize,
",Low"How do you detect overfitting?
When do you say overfitting is happening?
","When the r square value in case of, overfitting occurs when, are expected especially with unsupervised learnings when we get, because regression is an unsupervised learning.
When we get values of RMSC and all of them, it should range between 0 and 1, but we are getting either negative 1 or in case if,
It should align itself to 1, but we are getting a very low value of r square.
That time we can detect that where the overfitting or underfitting condition is taking place.
",Medium"How do you find out your vectors are independent of each other or not?
","Using cosine, we can use the similarity.
Cosine similarities can be used.
So, if the two vectors are independent of each other, they will have a cosine similarity of,
They will have a cosine index of 1.",LowIf they are independent?,"If they are independent.
They will have a cosine index.Yes,sir.
No, that is completely similar.
Cosine index is zero, is orthogonal.
If they are independent, then they will have a cosine index.
This is orthogonal,90 degrees.
Cosine 0 is written as one.
So, they will be similar.
Cosine is minus 1.
So, they are 1 sir.I think so.
They would be..
",LowCosine 1 means they are independent.,"If cosine is 90, they will be independent.
So, in case of cosine is 0, it will be independent.
They will be orthogonal.
In case of cosine, 1, they will be taken as similar, completely similar vectors.
",Medium"What is the formula for cosine similarity?
","Vector of A dot product of vector of B divided by root of vector.
We find the vector A root of vector.
",Low"What is root of vector?
","When we have x, y, when we have i and j factor, we square them and we try to find the norm of that vector.That will be taken as root of vector.
",Medium"What is that A with 2 bars by its side like bodyguards?
","That is vector representation.
Based on the value, they are in 2 dimensional vectors.
So, i and j will represent the unit vectors of each of them.
So, the value of let's say A or B, then we will take A square plus B square as the norm of this is taken as A.
The magnitude of A vector, into magnitude of B vector.",Medium"So, when you put A bar, what does it mean?
That is what you have written.",Magnitude of A.,NA"Magnitude of A.
So, you multiply magnitude of A to the magnitude of B.
And what is in the denominator?","This is a dot product of A and B vectors.

",Medium"So, magnitude of A is a vector or a scalar value.
",It is a scalar value.,Medium"So, how can you do dot product of scalar values?
",Dot product itself gives us scalar values itself.,Medium"But, What are you doing?
You are doing scalar into scalar right?","Sir, the multiplication is wrong sir,
I know the concept.",Low"Okay.
How do you reduce dimensionality?","We have various techniques like where in which we can use transformation techniques and we have reduction techniques.
Under transformation techniques, We have PCA which is proportionality component analysis, where in which we define various vectors into proportions.
And then we basically in transformation vectors, we define the features.
The features are then reduced into, they are extracted, they are modified by using statistical and mathematical models into other features by retaining just the information.
So, PCA we just incorporate them into proportionality component and then we define the.
",Medium"Then it reduces the dimension.
","We try to reduce the dimension using..
I am not sure.
In the other, in reduction, we filter, we have filter and wrapper methods.
So, in filter we try to pick out the features which are throwing majority, which have a majority influence on our overall factors.
And for wrapper we apply certain techniques on the filtered methods to in order to find out the accuracy.
",Medium"Okay.
So, that is how you do dimensionality reduction.
If you reduce the dimensionality by this technique, will your R square value go down or it will remain same?","If we reduce the dimensionality using these techniques.
R square value might improve.",HighWhy?,"Because if the vector is longer, then it might lead to a, if the dimension of the vector is larger, then it could lead to certain, what do we say?
It could, if it is, if it is seven, eight, two, it is always prefer to reduce the dimension of the vector significantly using PCA techniques.
So, that they can throw better accuracy in terms of regressive methods also.
They are likely to throw better accuracy.
",Low"Okay.
Good.
Any questions for me?
","Sir, will you leave me if I tell no?",Medium"How did the course go for you?
","Sir, I learned quite of, I didn't think I'd learn so much in ML.
I've actually, I've tried to push myself and learn something outside of just what the confinement says.
And I've taken a lot of notes.
It's very helpful for next semester.",MediumAny feedback for me?,"No, sir.
Sir, if you can incorporate more sums when you're teaching the concept, you do the sums after the concept itself.
The time that train of thought is harder to correlate.
Even when we're learning KNN, we learn it theoretically, sir that's what I think some of us faced in class.
We weren't able to correlate with how it worked.
Once we were able to solve the sum, we were able to correlate quite well what the it works.
",MediumI'm never lenient on good student.,"So, I don't think I'll come back to it.Thank you sir.",Medium"That is for me to assess, isn't it?
",,NA"So tell me, what should I ask you?","Sir Sir I have studied from mainly from like before midsem part like starting what are the models in ML like KNN and algorithms and decision tree and before thing parts sir.

",LowWhy? What happened after midsem?,"Sir, no, Sir, like I had just now like project presentation of other subjects. So yesterday only I was studying this part sir.",Medium"I am not talking about studying yesterday, I am talking throughout the semester. 

",Yes Sir.         ,NAWhat are ensemble models? Can you name some?,Sir.,NAWhat are ensemble models?,"Ensemble models, Sir, Ensemble models.

Models like I don't know that names what you are asking. I don't know sir.
",LowDo you know what is bagging and boosting?,"Bagging and boosting? No, Sir.",MediumWhat are the performance metrics used for clustering?,Sir for for KNN clustering we use K as and min this one like so when we see that graph mainly it comes under like U shape that bottom most we use as an K nearest this thing for KNN clustering.,MediumWhat is the difference between parameters and hyper parameters,"Sir for parameters for any, for any, for any of the for training the main thing we use is parameter above that what and all we use like which which more for stresses on the on outcome. That is, we are used for a cipher parameter.",LowSorry.,"What when we stress for output, what stresses something more that we call it as hyperparameter can?

",Low"Can you give an example?

","Sir umm so for example min max normalization I will take for any like like in that formula as there are many variables like first is A minus A Max by a Max by a min and B Max minus B min A acts as an hyper parameter. rest ALL acts as normal parameters.

",MediumWhat are activation functions?,"Activation functions, Sir. I don't know Sir about activation.   I don't know about activation functions sir.

",Low"In a KNN classifier, what happens if K is equal to number of training patterns?","In KNN, classifier in K is equal to number of classifiers.

",MediumTraining patterns.,"Number of training patterns Sir. There will be N number of training patterns, N number of labels will be there Sir. KNN clustering will be only for for clustering into one part into different labels, labels, labels, labels. So how much of amount of K will be there? That much amount of training patterns will be there, Sir.",MediumWhat are the performance matrix used for regression?,"Sir for regression like we use k also value Sir and for for Sir we we use like Y. For separating between two classes, we used y is equal to mx plus c like mx stands or in m stands for the slope for separating the matrix. For example, when you take it as a line, line as an for separating classes.

",Medium"That is, what is cosine similarity?","So in cosine similarity like there are many similarities like jaccard similarities or cosine similarity. In cosine similarity, what we do is it will give, it will take, it will give the angle of the vectors like A dot B by by taking the individual product of A and individual product of B dividing itself.  That is formula like. It will deal with vectors and a.
So dot product for cosine similarity.
",MediumWhat is A? What is B?,"Sir, when they will give at 2 observation values, that is observation values of A and observation values of B sir. Like for a they will give 5 and.",LowHow do you calculate what is A dot B?,"Sir, A dot B we calculate it by A and AB of first one and B&A&A of 2nd, B of second one and adding.",LowWhat does this tell you?,"Sir, this gives an angle like any in any plane the angle will be there. No Sir, this cosine angle it will give I think so sir.",LowSo this gives the angle angle in degrees or radians or what is it?,"Not in degree, Sir.

",NA"Radians.

","Not in. It gives a value Sir. Not in any kind of degree format, but.

",LowYou said it is giving angle.,"It is giving a similarity, Sir.",LowWhat does similarity mean here?  How does it tell similarity?,"Sir, in case of other similarities we don't use any vector as an like input to calculate but in cosine similarity we use vector values given.  Whereas in this thing in previously in Jaccard similarity and all we use binary digits like 0 or one format like F1 divided by.",MediumDon’t go to Jaccard and all there. How does this formula tell anything about similarity?,"Very vector similarity.

",NAWhy? Why that formula should mean similarity? Explain.,"Sir, I just solved the numericals sir like I did not in detail learn about theoretical part of cosine similarities.",MediumHow did the course go for you?,"Sir, course was Sir. It was very different when compared to other subjects. Mainly in other subject it was mainly like theory, theory based, theory based, continuous exam, exam exam or written based. But this was somewhat like new experience with where we first faced in this course. Like we had a hackathon, we had the lab implementation part and we have done like mainly every week, every week, every week we had to submit our assignments into GitHub like that helped more than learning theoretical part. We are done like practically and learned the models which helped not only for that moment for that particular assignment we have completed not just for the submissions like for hackathon sake and all. It helped really well Sir. Like it gave a like basic like first time we participated in hackathon in this sem itself. Like first what you are telling us. We had participated in some other hackathon also like I had told you like we one also Sir.Like in college only like we had an 3rd place and we got cash price also for that. Like it was helping in a practical way, Sir, that is what.",MediumAny feedback for me?,Sir Nothing Sir like what you gave us. It was like we not need to compare but you are the like it was best. Sir like you are taken like some 80 classes like still now we are no teacher took like 80 classes like it was amount of class also amount of knowledge also it was very good Sir by the end of.,MediumThank you very much.,Thank you sir.,NA"Please close the door.
So,Tell me what should I ask you?
","Sir, decision tree.
",NA"Decision tree.
How is decision tree used for regression problem?
","Sir, decision tree classifier.",NA"Okay,regression tree?","Sir, I didn't go through regression.
I only went through decision tree classifier.
",High"Decision tree classifier.
Okay, so tell me how is a decision tree constructed?","So initially the data set will be taken as the root node.
And then based on…",Medium"The data set will be taken as the root node.Okay.
","Based on a specific feature, the LB split and then... ",Medium"How do you split?
","We split, we try verifying, or you can use cross validation to get the proper split.
According to that split, if information gain is higher, we keep that split.
If information gain is lower, you don't use that split.
",High"Information gain.
","Yes sir.
",NA"How do you calculate information gain?
","It is a system entropy minus the leaf node's entropy.
H(S)-H(Si)
",High"Okay, how do you calculate the system entropy?
","The system entropy is minus log... No, minus summation of probability log probability.
",Medium"That is the formula?
","Yeah,minus in the front.
",NA"Why there is a minus?
","A good question sir.
",NA"Thank you.
","Not sure sir, I just memorized the formula.
",Medium"Okay, what is that probability?
","It's the probability of a variable as in... And suppose there's a table.
And then... 
",Medium"Why don't you take an example and explain?
","Yeah, like... marital status.
Yes, yes, no, yes.
And if we have to calculate the system entropy for...
If we have to calculate the split for this, then entropy will be...
Minus...
",Medium"So this marital status, yes, no, whatever you have put, is that one of the features?
","Yeah.
",NA"Okay.
","You take minus 3 by 4, log 3 by 4, and then minus 1 by 4, log 1 by 4.
",High"So this probability is the probability of occurrence of different values of the feature.
","Yes.
It is the probability of the outcomes of the feature.
",High"But you took the different values of the feature.
Isn't it?
","Yes.
",NA"Or did I make a mistake in understanding what you are explaining?
","The outcome of the feature only.
You take the probability of the summation of the outcome of the features.
No, summation of the minus probability log probability of the features.
Yes.
",Medium"So you take this is system entropy.
",Okay,NA"So you have yes and no.
So you calculated the probability 3 by 4, log 3 by 4, and then minus 1 by 4, log 1 by 4.
So you will split.
How will you split?
","You need one more feature.
Suppose there is boy girl, or man, or woman, and then their marital status is yes, no, yes, no.
And you split based on that.
Like 3.
",Medium"So you are splitting one feature.
You are splitting one feature based on the another feature.
","No, you're taking one feature as the root node.
",High"How do you take that root node?
That is the question.
So you said one is marital status yes, no.
Other is let's say sex, which is boy or girl, Okay?
So combining these two features can you explain how you find the root node?
","Sir,trial and error.
",NA"Trial and error.
Okay.
Okay.
Fine.
So let's say you have constructed a decision tree.
","Okay.
",NA"How will you find out whether this construction is a good tree or a bad tree?
","So if the information gain is high for the split, then it's a good split and good tree.
",High"But there is no more split.
You have already constructed that.
","Oh then we should make sure there is no overfitting underfitting.
",Medium"Yeah.
Overfitting underfitting.
How do you find whether the decision tree has overfitting or not?
","Sir if the tree is too long, the depth goes for too long probably overfit occurs.
And if the depth is too small then it will be underfitting.
",High"So this too long, too sort are abstract statements, qualitative statements.
Okay.
So if I put like, you know, okay, you have got good marks, then you pass.
If you get bad marks, then you fail.
Then I can't declare you pass or fail.
","Yeah.
",NA"I have to have some number.
","Yeah.
",NA"So here is too long, too short is abstract.

",So then the hyperbolic parameter depth should have a value.,Medium"Yes.
So how will you decide?
","We assume the size of the data set may be.
",Low"Okay.
So let's say you have 100 features.
","Okay.
",NA"So what should be the right size of that tree?
So that it doesn't have overfitting.
","Okay.
So 5 may be, okay.
",NA"If you have 1000 features?
","10.
",NA"10.
And if you have 5 features?
","Hmm.
1.
I'm not sure.
",NA"Okay.
How is decision tree sensitive to data normalization?
","I think you normalize the data first then you build the tree.
",High"Yeah correct.
Is the tree construction sensitive to data normalization?
That is, if I don't normalize the data, will it affect my tree construction?
","Yes.
Outliers will be there, no sir.
",Medium"So you say yes, it will affect.
","Yes.
Or it might like only one side of the node will keep getting built and other side won't.
",Medium"Okay.
And how about filling missing values with central tendencies?
Will that affect your decision tree construction?
","Yes sir.
The frequency will change right of each split filling of the missing values.
",Medium"So with normalization, the frequency changes?
","Yes.
",NA"When normalization, frequency also changes, okay, can you tell me how?
","For example, you handle outliers with Z-score that will make the tree more less prone to overfit, undrfit.",High"Okay.
Interesting answer.
","Okay.
",NA"How did the course go for you?
","Sir, it was fine.
",NA"Any feedback for me?
","No sir.
I think one of the best faculty I've had.
",High"Thank you very much.
Okay.
",,NA"So,please tell me what have you prepared?
","Sir, basically like, after mid semester, due to health issues, I could not concentrate.
I did not come to college.
Sir, before mid semester, I can..
",Low"You did not attend any class after midsem?
","I attended classes sir.
But I couldn't concentrate.
",Medium"What health issues did you have?
","Like sinus problems sir.
And like, due to weather, I did not and like here in bangalore,like I did not get time,
Like, I was hospitalized,
Like, for a, almost, almost every week.
Like, issue was there,so I could not concentrate.
",Low"Okay.
So, can you tell me what is normalization of data?
","Normalization of data,
So basically when there is complex data points like a training we'll normalize 
",Medium"What do you mean by complex data points?
",Imbalance data.,NA"Imbalance data.
What is imbalance data?
",Like..,NA"Okay can you tell me how do we fill missing values?
If we have missing values in data what do we do?
","Basically we will use the concept called label encoding sir.
So we will convert categorical data into numerical data and we'll use sir.
",Mediu  "But when you have missing values how will you do encoding?
Values are non-existent.
Can you tell me the performance metrics used for classification?
","Shwartz coefficient, Kolinsky coefficient and Devis coefficient sir,Devis Index.
",NA"Can you write the formula for Manhattan distance in n-dimensional space?
",Okay sir.,NA"Ok. Can you write the formula for Jaccard Similarity and tell me where is Jaccard similarity used and why?
Give one example situation.
","Ok sir.
",NAWhat does that mean?,"Given A and B, two sets Jaccard Similarity is calculated.
The number of common things in both the sets A and B divided by number of elements in set A plus number of elements in set B minus number of elements common in both A and B.
",Medium"What is this set A set B?
","Sir,two sets.
",NA"Yeah but how does this relate to Jaccard Similarity?
Okay can you tell me what is rank of a matrix?
","So the rank of a matrix is a value, which the determinant of the matrix becomes zero.
",Medium"The rank of a matrix is the value where the determinant of a matrix will becomes zero.
Okay.Do you know what is high dimensional data and what are the problems we face because of high dimensionality?
","Overfitting and underfitting sir.
",NA"Overfitting and,okay so tell me what is overfitting?

","Overfitting in sense like when there are few data points.
So when we are trying those data points will be able to train on dataset but when we try to generalize it to new examples it won't be able to.
",Medium"Very good.
How did the course go for you?
","Sir it was fine but later after the midesem I couldn't concentrate so in these holidays I thought I will work on all those things.
",Medium"Sure, And any feedback for me?
","No sir, it was absolutely fine like before midsem I was completely comfortable like I was understanding superb.
I was able to perform.
",Low"It's ok. Thank you very much.
","Thank you sir.
",NA"So, please tell me what do you mean by independence of vectors?
","Independence of vectors.
",NA"Yes.
","Okay.
So, um.
",NA"Hey are you there?
I can't hear you.
Hello?
","Hello, sir.
I'm audible now.
",NA"You're audible now?
","Okay, sir.
So, sir, uh, can you repeat the question once again?
",Low"What do you mean by independence of vectors?
","Independence of vectors.
Independence of vectors as in the features in the in our data sets.
Vectors, they represent their relationships.
So, dependence or independence tells us about the relationships the features share.
So, when we talk of independence, like linearly independent, the vectors are linearly independent as in.
It can tell they are like a unique like, um.
Like, um, like the like the like the model can.
Like the relationships that the model tells the features have that is that is unique and accurate.
Like, um.
Yes sir, it's like that.
",Medium"Okay.
Does independence and orthogonality do independence and orthogonality mean the same thing?
","Independence and sir?
",NA"orthogonality.
","Okay, orthogonality.
Okay.
Do they mean the same?
Okay.
So, independence and orthogonality are.
They're not the same thing.
Like, um, when we have two variables like X and Y if they are independent.
Then the like one happens like occurrence of one does not affect the probability of the other.
That is how independence in independent vectors work.
And it when we come to orthogonality, when we have to vectors a and b, u and v. Uh, if they're orthogonal, their dot product is zero.
So, basically, they are at right angles.
So, uh, uh, uh, uh, pair of vectors, they're orthogonal.
If every pair in the set is orthogonal.
So, like independence and orthogonality are different because independence does not tell you about linear relationships.
Whereas orthogonality is like they are perpendicular to each other.
Um, like, um.
Like orthogonal vectors, they can always be linearly independent.
But the reverse of it is not necessarily the same in all the cases.
Like that.
",High"very good.
That's very good.
What is the difference between mean and median?
","Okay, with respect to, um, like a dataset like that, sir.Yes.
Okay, mean and variance, sir.

",LowMedian.,"Okay, median.
Okay.
Um, when we talk of median, like all the, um, all the rows.
Okay.
Okay, so mean as like, uh, you, uh, whatever entries you have, the distribution of it.
Um
",Lowyes?,"Hello, hello, sir.",NA"Yes.
","Are you listening to what I was telling you?
",NA"No, I didn't listen.
","Oh, the mean and again, I will tell, sir.
",NASure.,"Okay.
Um, whatever mean and median, okay, mean and median.
Okay.
So mean as like, uh, summing up all the values and dividing it by the number.
So, uh, the proper, uh, that is definition, but then mean, uh, and I'll actually then the median also.
Median is like, even though it is the middle value, but again, it's ascending and ascending order.
That we take and then the middle value.
And so the major difference that would come other than the definition would be, uh, with respect to the outliers.
Like a mean is very much sensitive to outliers when compared to median.
Like, uh, like mean is useful in certain situations like where all the values are very much relevant.
Like they, they have, they have a, they have something to do to the average of the values.
Like it's normally distribution, normal distribution.
Um, but when it comes to a median.
The median is not affected by outliers much.
So, uh, it is used in, uh, situations, uh, which has skew of the numbers, no, that is data science, one second, sir.
And it's like, it is used where, uh, the data set has outliers.
But then it doesn't affect much.
So it is a central tendency that is chosen in most of the scenarios.
Basically, um, yeah, normal distribution, we was mean a lot.
I think that's where the difference comes when we are using it.
",High"Right.
Thank you very much.
Good night.
","Okay, sorry for the network issues.
",NANo issues.,Okay sir.,NA