teacher ,student,fluency"
Can you explain the db scan algorithm
?","Sir, when there are two, I mean sir, I don't know what, how it is a euclinar project.
When there are two vector numberings, we will check this.
The viscane is density based clustering.
So, we take the density parameter into consideration and check both the vector numberings.
If the measure density parameter comes in the range, we cluster them into the group.",MediumHow is it different from k-means clustering?,"
k-means is a hyperparameter clustering.
We define k before doing this clustering.",High"So, what is wrong with it?
Means we… Is there the only difference or there is some other difference?","
So, k is predefined.
So, we can obtain those many clusters only at that time.
Like how we didn't have a project is, we applied only db scan and this can we did'nt apply kmeans because we need to use a hyperparameter k value, which we should define before doing the clustering.
So, we didn't use K-means clustering.",Medium"
How did the course go for you?","
It was a good understanding.
New knowledge I didn't… Because before they started this course, I didn't have any knowledge in the machine learning.
After this, I had decent enough knowledge.",MediumAny feedback for my improvement?,No sir.,NA"
Thank you.Thank you.
your roll number is 114.",Yes sir 114.,NAis your project  classification or refression ,"It is a classification, clustering and the sum part of the project in the regression part.",HighWhat is your project?,"Our project is based on the regression analysis of the mathematical expressions, algebraic expressions using the regression models.",HighWhy are you using the regression there?,"
Since in the answering part we have the continuous first thing.
We have the marks, it is like 0.25, 0.5, 0.75,  and all these continuous parts.
So to calculate that we are using the regression, because that may or may not be the correct one, it is like labels.
They are not predefined.
That's why we are using the regression.
Predefined we will be using classification.
So it is not predefined and it is continuous, not discrete.
So that's why there is.",High"
So you have mathematical expressions, ","
algebraic expressions.",High"
They are available to you as vector or as text.","They are available as a text, we have converted into vectors.
",HighHow?,"It is using the embedding's math, code, but another thing.",HighWhy did you do embedding?,"It's like when they are in text form, they will be can't, for the features form, we can't directly convert to the text, we can't analyze the text directly since we are mean, when we convert into vectors, there will be these many dimensions which resembles the same text.
So means like it is somewhat positive, somewhat negative, 0.01 or 0.0 to 1 something, till there are 7 decimals like that, where I have answer.
Each embedding represents the each text like that.
Means like for the point, one text, for the verb like x or variables, numbers, for everything there are separate embeddings, vector.
Means that's why we are using that.
So to analyze, it will be easy when you calculate the performance for regression.
","So, what are the different performance metrics used for regression?","MSC, RMSC, MAPE and R2 scores.",High"
Can you write the formula for RMSC?
",Yes ,NA"
What have you written here?
What is this?
X, X, what is this?",mean ,NA"X, what mean?",Mean and the individual observation.,High"Okay.
So, you are subtracting the mean from the original observation.
From the original observation.","
Yes, means it.",NA"Okay.
And then what is this one?","X, the observation and.",NA"So, where is your prediction?","
Sir,
you don't need the predictions to calculate.
RMSC, ",High"So, where is it?
It is not there in the formula.
What is the output of this?","Output of the system prediction.
No, no.
No idea.",Medium"No idea.
Okay.
So, what is the data normalization?","
Yes,",NA what is it?,"It means that if there are any external means like 1 to 5 we are having the data continuously.
But there is another number that is coming from the means like with the used variations deviation like 20 or 13 like that.
Then we use the data normalization to remove these out layers, 20 and 30.
And we set that to the 1 to 5 like that.",High"Okay.
We take the 1 to 5 like this and all this.
Okay.
So, you are saying you will be able to remove from data some out layers using normalization.",Yes sir.,NA"
Okay.
What are the different normalization techniques you know?","Zscore normalization.
And like that sir.",Medium"Okay.
So, how do you do Zscore normalization?","
Zscore is using the mean and the standard deviation.
So, means it will be like z equal to kind of a to 4.",MediumYes.,"The Z value is equal to x minus mu by sigma sub 2.
The mean and the variance means standard deviation are used to calculate the Z value.
And again from the Z table, means we will be having the Z table, Zscore table.
And then we will be assigning the number to that.
",MediumSorry.,"After getting the Z values, there is a Zscore table P of z will be calculating.",MediumHow do you calculate P of z?,"
It is from the Zscore table.
It means P of z less than or equal to x something x from x.
",MediumWhat is x?,"It is like the, these x are the observations.
For all these, the x is a label.
If this z value is less than or equal to the x1 observations, in the total observations of x, we are checking whether the z is present or not from the Zscore table and we are giving a value for that.",Medium"Okay.
Right.
And how what will you do if the data is available in categorical values?","Categorical values.
First we will be using encoding.
We can use it sir.",Medium"
What kind of encoding will you use?
","There are two label and one words sir.
For the label encoding, if you use that, it will be intact sir.
The data storage will be saved.
Means like Monday to Saturday, we can give 1 to 7.
But when we use the 1 hot encoding sir, for the Monday to Saturday, it requires 7 bits, 0 for first question.
Means for Sunday, all 0s and last bit has 1 for Monday, 5 0s, 1 and 10 0.
So for this one, the data will be, means like the storage takes a little more.
Because it is converting to vector form.",LowWhat is converting to vector form?,These 0s and 1s.,NAOkay.,"
7 bit 1.",Low"
Okay.
Right.
So now, if you do Z-score normalization, sorry, you are doing 1 hot encoding.
Does the data dimensionality increase or does it decrease?
","Increases sir.
Because from the vectors, when it is from 1, we are changing that to Monday, means like 1 dimension sir, Monday is an M. And we are converting that to 1, 2, 3, 4, 5 and 1, 0.
We are increasing the dimension sir.
Now it becomes 7 vectors.
So the dimensionality increases.",MediumSo does it have any disadvantage by increasing dimensionality?,"Sir, when we increase dimensionality, the processing will be a little complex than the single time when we do 1-div dimensionality.
When the dimensional increases, the complexity of the processing also increases.
",High"Right.
So you have disadvantage.","
Yes sir.",NA"
Is there any advantage?","
I have no idea.",NA"
Okay.
How did the course go for you?","Well sir.
Along with that, we got even from the, even we have performed the small pattern of FDS.
And that also we have results sir.
These are glomatic, clustering and all this in the data sense.
But, okay.",MediumAny any feedback for me?,All good sir.,NA"
Thank you very much.",Thank you.,NA117,"
Yes.",NA" Please close the door.
What did you study for viva?","Sir basics i studied Basic like more classification.
More classification.",Medium"Okay.
What is the difference between naive based classifier and hmm?","Sir, naive  based classifier is first we will assume that all the features are independent.
And then through Bayer's theorem we will do the classifier.
Hmm i don't know sir.",Medium"
What is Bayer's theorem?","Bayer's theorem is like a finding probability of one with respect to other and if we need to find the probability of a by b.
Also p of b by a, n, p of a by all of.",High"What is a, what is b?
In your classifier scenario.","If we want to find a, early.
Prob, as for suppose if probability of dog such that cat with respect to cat.
Given that it is cat.",Medium"Complete.
I thought you are still telling something.
Okay.
Fine.
So this is naive based algorithm.",First we will assume that features are independent.,HighHow do you find if the features are independent?,"
Now we find using cosine similarity.
If the values between 0 and 1 then the features are independent.",High"Features are independent.
Suppose they are not independent.
Okay.
What will you do?",I don't know sir.,High"
Okay.
Suppose you normalize the data.
Does it affect independent.","If you can normalize the data, does it affect independent?
",HighYes.,"
No sir.
No sir.",NAIt does not.,"Normalization is converting the vector into one form.
Like main max scaling.",HighRight.,"So.
I think it does not affect independent.",Medium"It does not affect independent.
Okay.
Good.
Suppose you have categorical data.
How do you find out if the features are independent of?","
We will first do encoding.
Like label encoding or one coding?",High"
What is the difference between label encoding and one hot coding?","A label encoding is will assign the labels.
Like for a red, let's say, not for a, suppose, poor.
Let's say it is zero and very poor.
It's one satisfied.
It's two.
But in one hot encoding, if that, the data is present in that data set, then it will put it as one.
Remaining every label will become zero.",Medium"So, when you do one hot encoding, does the dimensionality of the vector increase or does it?",Increases.,NA"What is the effect of increasing dimensionality on the performance of a classifier?
","
Sir, it may become overfitting.
Noisy.",Medium"It may become overfitting.
Okay.
So, what would you do then?","Sir, again, I will reduce the dimensionality of that.",HighHow?,"Like there are some techniques, PCA or LDA.",High"
How does PCA help reduce dimensionality?","
PCA, it converts the vector into lesser dimension.
It mainly focuses on variance.",HighHow does PCA convert it into lesser dimension?,"The vector of one dimension, it converts into lesser dimension.",Medium"
How?","How, I don't know.
But it maintains the variance.
Same variance.
That is the…",Low"But it will reduce such dimensionality.
And if it reduces dimensionality, variance is a return.","
Maximum variance will do it.",High"
Maximum variance will be return.
Can you tell me one situation where PCA will not work?
It will fail.","
It will fail.
Now, PCA is used for unsupervised.",HighPCA is used for unsupervised,"
PCA is used for unsupervised.
Without putting any labels, but LDA we will put labels.",Medium"Can you give one example problems scenario where unsupervised learning will be used?
",Supervised.,NAUnsupervised.,Clustering.,NA"Clustering.
Where?
Tell me where clustering can be used.","
Clustering can be like for example basket.
Market basket analysis.
In that, we find the pattern in the market.
First of all, a person by bread.
If a person by bread, he will buy jam and butter along with that.
So, we will find a pattern like that and we will put it together.",MediumWhat algorithm do you use for market basket analysis?,"
I don't know sir.",HighThen how can you say it is unsupervised learning?,"So, we are finding the patterns in that.
There are no labels.
Predefined labels.",HighBut what is learning there?,"Another example is market.
Finding the similarities of the market.",MediumWhat do you mean by similarity of the market?,"Not Similarities of market.
Finding the patterns in the customer.
Buying some goods.
Example.",High"
Okay.
How did the course go for you?","
Good.
",NAWhat was good about the course?,"Sir, I learned this course that is a little bit.
I don't know what is ML before also.
Okay.",LowWhat is your feedback for me?,It's good.,NAThank you very much.,"Thanks.
Sir, I was not good.",HighYou tell me.,I think it's not good.,High"
You think it's not good?",Yes sir.,NA"Okay.
You can improve next time.",,NA" So what have you prepared for viva?
Where should I ask you questions from?",That classification sir.,Medium"Classification.
Any specific model?","These and all i prepared ,formulas sir.",Medium"Formulas you prepared
How will you use a support vector machine for multi-class scenario?",,NA"No idea.
Okay.
So for classification, what are the performance metrics which are used?","For clustering.
For clustering.",NA"For clustering.
Classification.
No idea. Okay
What is normalization of Data",Normalization i know sir.,NA"You know. Okay tell me what is it.
Do you know names of some normalised algorithms?",,NA"No
Okay.
What do you understand by vector independence?","The Vector independence.
Telling the independent or dependent?
",MediumYes.,"By taking some examples.
Let's take an example of this.
Independent or independent like that?
If these two vectors are the normalised, if this vector is multiple with two means, it will be get this vector.
We can tell that it is dependent or else.",LowHow do you present that mathematically?,"Mathematically.
One by x plus.
Like this, two x plus two.
Two x plus two y.
This vector.",High"Okay.
What are the problems of using high dimensional vectors?",High dimensional vectors means we can't tell like this.,Medium"Then how do you tell?
Okay.
Do you know what is encoding?","In encoding.
In  encoding two types are there.
In encoding two types means one will be in range sir.
Zero to.
If we, if we, at days are there.
Monday, Tuesday, Wednesday, like that.
Monday we will get one like that.
Zero to seven sir.
In encoding, that is one type.
That is one type.
One type.
Female and male.
For female, zero or male, one.
Where is that, that, that names, that's two types are there",Low"
Why do we need encoding?","
To represent.",NA"What do you mean by that?
Can you explain?","In math, it goes over more.
If we, if we take zero to sound mean Monday, Tuesday, Wednesday, Wednesday.
Like that up to Sunday, Monday, Monday we will get zero.
Monday, one, Tuesday, two like that.
In female and male, there only two is there no sir.
Or three male or male.
Zero, one.
Only zeros and one star.",Low"
Correct.
That is correct.
That is not my question.
My question is why do we do encoding?
Not how.
You are saying Sunday will become zero, Monday will become one.
Tuesday will become one.","
Like that examples will come.
",Medium"But why do we have to make Sunday equal to zero Monday equal to one?
Let Sunday be Sunday, Monday be Monday, no?
What is the problem?","
This is a mathematical problem",High"Okay.
How did you find the course?
How did you find the course?
How did the course go for you?
Any feedback for me?",No sir,NA"
Thank you very much.",,NA Good morning.,sir,NA"Ram Charan, good morning.","
Good morning, sir.",NADid you have breakfast?,Yes.,NAHave you prepared well?,Prepared.,NAWhich module have you prepared well?,"
Supervisor learning and unsupervised.",High"Supervisor.
Okay.
What is your roll number?","
123, sir.",NA"123.
Alright.
What is supervised learning?","In supervised learning, we have classification and regression, sir.",HighYou have classification and regression in supervised learning?,"Yeah.
In classification, decision tree.",HighWhy is it called supervised learning?,"
Predicting the outcomes from the inputs.",High"
Why?","Inputs and outputs are target value and inputs are given.
That is all.",Medium"Okay.
That is why it is called supervised.
But why?","From input values, we will find the predicted values.",High"Okay.
So if the output values are given, how does it help you?","
Output values, we have to predict the output values from input attributes.
Attributes",Medium"Okay.
Okay.
Right.
So that is why it is called supervised learning.",…..,NA"
What is unsupervised learning then?",KNN.,NA"
KNN is unsupervised.
What is K in KNN?","value.
Nearest neighbor value.
K value.",NA"
What value it is?",Based on the question.,High"I didn't understand.
Can you explain?","If...
Number of nearest neighbors.",Medium"Number of nearest neighbors.
That is K. Is K a parameter or hyperparameter?","
Parameter.",NA"
It is a parameter.
So you learn the value of K during training.",The question only is given as K value.,Medium"
Then how does it become a parameter?",Hyperparameter.,NA"Hyperparameter.
okay
Now suppose I have given a problem for KNN classifier.
Other than data set.
What should I give to you?","Some points.
From that we have to calculate the distance and we can find the KNN. ",High"Yes.
The data set is given.
You have the data set that is already there.
What other information you need from me for you to build a KNN classifier?",no sir.,NA"You don't know.
Okay.
So how do you measure whether the KNN classifier which you have built is good or bad?","If K value is 1 or 2 means accurate means we can find.
If it is too low or we can say it is overfitting.",Medium"Overfitting.
You are saying K value too low is overfitting.
Why?
What is overfitting?","
That K value is too low.",High"K value too low is overfitting.
Yeah.
That you have already said.
But my question is what is overfitting?",A low variance,NA"Low variance.
When do we say a situation?
Tell me the situation where we call that it is overfitting.","
After calculating the distance.",High"After calculating the distance.
We will call it as overfitting.", not overfitting.,NA"then.
So what is overfitting?
That is my question.",Definition i don't know,High"
Definition you don't know.
Why?
Suppose we have very high dimensional vectors.
Okay.
Is it good or bad?","
Means in what?",NA"
I have high dimensional vector.
That is now lot of features are there with me.
Okay.
Is that a good thing or a bad thing?","
For what?
For predicting the output?",High"
Classification.","
Maybe it is.
We have high attributes.
We can predict the output easily.",High"Okay.
So it is good.
Is it always good?",That one no.,NA"That one you don't know.
Okay.
Can you think of a situation where it is not good?",Means very.,NA"Or suppose we have lot of features.
What kind of problem can it generate?
Or can it create for us?","
Correct output.
From which attribute we have to take the predicted value we can't measure no sir.
If too many different input attributes are there.
Too high at.",Medium"
Okay.
you know what is normalization of data what is it?","
Formula",NA" Formula No, no I'm asking explain what is normalization what do what is normalization why do we do it?","
Distribution of data ",NA"
Distribution of data what do you mean by that?",If the data set is given from that we have to we can normalize it,MediumYeah but what is normalization?,No.,NASuppose I say multiplication what is multiplication?,"
Product of two numbers ",HighProduct of two numbers that is called multiplication similarly what is normalization of data?,"
Taking the average value",HighWhat is average?,Average If 10 attributes is given total addition of 10 by number of by 10 average ,Low"
So what does that number average tell you about the data?",Most repeated value most repeated value I think Not repeated sir middle value ,Low"
Average is the middle value?",Uh huh ,LowOkay no problem How did the course go for you?,Good,NA" Why was it good?
What was good about the course?",Teachings,NAWhich aspect of teaching you found it good?,"
Explaining clearly ",HighExplaining KNN was good,Clearly ,NAExplaining clearly was good Okay Can I do anything to improve?,No You are good sir,NA Good Nothing can be improved Okay Thank you very much, Thank you sir ,NA What have you prepared?,Everything I revised like basic only.,MediumYour project is a classification problem right?,Yes sir.,NAWhat are the different performance metrics used for classification problem?,"
Precision recall accuracy of F1 score.",HighWhat are the difference between precision and accuracy?,"
The accuracy is based on the true-positive-plus-false-positive.
It takes all the actual predicted values by total values.
Precision is based on the true-positive.
Only true-positive by true-positive-plus-false-positive.
It is a ratio of true-positive by all the predicted positive values.",High"Okay
That is the formula you said.",Yes sir,NAWhat does it mean?,"Precision is the measure of the predicted true-positive values.
Precited true-positive values to the ratio of actual predicted values of model.",High"That is again a formula you are talking about ratio.
What does it mean?
When you say ok precision is, suppose I said that precision is 60%.
What does it mean to you?","It means like true-positive are more then...
There are more true-positive values than wrong predicted true values.",Medium"Ok. Right ,What is margin and support vector message class of here?","It is the separation between the two classes, support vectors.
The more the margin, the better the model.
less the margin, the worse the model.
It is basically the distance between two sub-support vectors.
",High"Ok.
Right.
So, more margin is good.","
Because it is more separated no sir.",Medium"So, why is it good?","Like it is not over lap.
It is more separated.
So, the model works good on that.
Even... ",HighYou are telling right?,"
If it is, the margin is too less means.
We cannot classify more easily.
If the margin is more, it is more separated.
So, we can...
The model works so well.",Medium"Ok. Will this large margins, small margin, have any impact on the performance metric?",Yes sir.,NACan you relate?,"
Yes sir.",NA"Tell me.
Suppose margin is large",Yes.,NA"How what will happen to your precision, recall and all that?","
Sir, if margin is large, misclassification and all, I don't know how I know.",Low"You have, you are just getting tense or stressed or scared or whatever.
Ok.
Yes.
Give it a shot.
It may be wrong.
Why are you worried?
You are going in the right direction.","If margin is large, misclassification, things are not going to get into the soft margin.
So that we... ",Medium"
You don't want to even try.
Ok.
So, is SVM a supervised classifier or unsupervised?","
Supervised.",NAWhy?,"Sir, it works on the first labeling of all the representation in graph are done by the supervised.
So that if new unseen data comes based on the supervised, all the like seen data will classify now.
I mean, first we classify them based on the labels.
And for unseen data, we'll take based on the group it belongs to will classify unseen data.",Medium"Ok.
So, that is why it is supervised.","Yes, sir.
Like, it takes the labels for trying.",HighCan you use support vector methods in a multi-class scenario?,"
Yes, sir.",NAHow?,"
In multi-class scenario, you can take one class one side, other remaining classes one side.
In that way, we can try more, more ways and more like we can form a brute force, like one model, one set remaining classes one side, two classes one side remaining classes one side.
In that way, we can form one.",Medium"You can work on it.
That is correct.Okay
So, now, suppose you are using a neb classifier.","
Yes.",NAWhat is the assumption you make before you start?,"
Independent.
Features are independent.",High"Ok.
Independent.
Good.
How do you find if the features are independent or not?
","How do you find, first we make the, we make assumption as the features are independent.
Like, based on the problem.",High"
That is the assumption you are making.","
Yes, sir.",NA"Now, my question is, how will you find out if two features are independent or feature?","By P of A intersection B equals to P of A into P of B is not equals to P of A intersection B, then they are not independent.",Medium"So, what is A?
What is B?","
Is one probability of A and P of B is the probability of P?",Medium"You have two features.
Right?
Let us say two features are valid.
The number of hours you have studied for the Viva and the other feature is how much breakfast you have eaten.
And this is collected from all students.
What is A here?
What is B here?","
Hours of-studying is the A.",High"
So, many people have different hours of studying.
How will you, ?","
we will bin them.",High"Ok, then what will you do?","
Like, based on the, I will take certain threshold less than the hours as one and greater than the hours as one.
Like that I will find the probability.",Medium"
Ok, you will find the probability for each pin.
So, you will have some number of bins for one feature.
You will have some number of bins for the other feature.
They may be same, they may be different.
So, how will you find whether they are independent or not by probability?","
Sir, I will find the probability of one feature and I will find the probability of another feature.",HighCan you find the probability of the feature?,"Sir, based on the bins I will find the probability of the bin- So, total of hours.",Medium"Ok, then any other trick is there for finding out whether the features are independent or not.
","
Cosine-Similarity",NA"Right.
I do not know, you are just hesitating.","
Cosine-similarity",NA"Yes.
Using cosine-similarity, how will you find out whether they are independent or not?","If cosine-similarity like zero orthogonal, sir, we cannot say whether it is independent or dependent.
But if it is between zero and one, it is independent.",High"Good.
Very good.
How did the course go for you?","Well, ",NAwhat went well?,I learnt many things.,Medium"
Ok, how did I do?","Sir, of course, you do nice.",High"
Any feedback for me?",Nothing.,NA"
Thank you very much.",How did I do?,High"You did?
Fairly, ok. You have studied a lot of things.
But you have not thought on them.
You need to think and understand.","
Yes.",NA"
Only then you will be able to relate things.",Yes.,NA"Understand.
But that will also come with practice.","Yes.
Yes.",NA