teacher ,student,fluencySo that it will boost your confidence as joys are evident.,Yes sir.,NAOkay.,Yes.,NAAnd if it back for me.,Yes sir.,NAYeah.,You can be a little louder sir in the class.,NAThank you.,Thank you sir.,High"So, we are as whatever we studied.",Yes sir everything except the last few parts I have studied everything.,HighI mean whatever prepared well for the virus.,Okay I know KNN then the normalization then recreation model and clustering.,Highvery good.What is the difference between clustering and classification?,The classification we the clusters are defined.The number of clusters are given already.In that cluster when the data is taken data point we have to just categorize it between those clusters which are given.But in clustering what we do is we make the clusters from the given data set.That is the difference.,MediumWhy do we make clusters?,Because some data points are related like the distance between some data points is less and that am is how to handle.Some group of data they have distance between them is almost less.And compared to other kind of data which is more.So basically if we see a graph then they are already forming two clusters.So that is how it goes.,MediumYeah that is how it is done.Why is it done?,Why clusters are why we are making clusters?,MediumWhy we are making clusters?,Okay why we are making clusters?Because data points represent something.I mean if they are forming a cluster that is giving us some data about the cluster.I mean the how are the data points?What they have in common?So that is required for us then like for prediction maybe this cluster with some weightage and the other one with some weightage will give us the profit prediction.That is why we are making clusters to analyze data.,HighVery good.,Thank you.,NAThat is good.And how do you measure the performance of a clustering algorithm?,"Of a clustering algorithm.You mean the silhouettes go around the building?Yes sir.So these are the two criteria in silhouettes go what we do?We find the average of in one cluster we find a we take a data point and compare to all the data points of that cluster with the formula BI, BI minus AI upon minimum of BI comma AI.Well that is the formula basically.And what is AI?AI is the distance between your this one data point of one cluster to the other data point.And in the formula what we are doing here?They are multiple clusters right.So which one is the nearest to this cluster which has having the data point?So we take that.",HighVery good.Can you tell me one scenario where clustering will fail?,Clustering will fail.Clusters.,LowYou may not be able to farm.,Yes sir.Yes so that can happen when clusters are either overlapping the form constant circles or they are varying near to each other.In which we are in case we are not able to form a particular I mean linear line between the two clusters.We are not able to differentiate between the two clusters.,HighSo that is okay fine.Okay so let us say you have data which is available to you with all categorical variables.,Okay.,NACan you use it for cluster?,Yes sir.With the categorical data we can directly meet the clusters because every data point they are forming I mean there will be three or four categories or number I mean the specified categories.So we can form directly a cluster based on the category.Like cluster is category that does not mean.,HighWhat kind of cluster in algorithm will you use?,For this one.Clustering algorithm.Okay.Because give will represent the different distinct categories.,MediumOkay.Right.So suppose you have lot of missing values in the data.Right.What do you do?,"In a clustering problem if you ask me if a cluster and that data points are having many missing values.So they can have two things.One is global mean average, mean medium mode.I can take orders based on the cluster.If some data point is belonging to one cluster.So what is the mean of that cluster itself?I can take that value.",HighBut your data is missing value.How will you prove it?,Okay.In the first place only.,HighRight.,So the one is if it is category will I will find the mode.,HighOkay.,I will fill it.If it is this one numerical without outliers.Without outliers I will take mean.And without outliers I will take medium.,MediumSo when you are feeling these missing values with central tendencies.How will it affect your clustering?,So I don't think it will affect much.Just a minute here and there it will be there.Because at the end what we are giving what we are assigning the value to it.Is something which is already forming a cluster.So it won't make a lot of difference.I mean it won't be like I have found something for the data point which is related to this cluster.And if I have a fail of missing value for that.Okay.Okay.Okay.There can be one or the number of missing data points.It can be a scenario where a data point which is belonging to cluster A but it is showing a cluster B.This can happen because maybe that one because we are finding if we are finding mean.And it is also possible that something which belongs to this cluster may go to that cluster also.So this can be the scenario.So there are many missing data points and this scenario can be created.,MediumThat is very good and you did very well.,Thank you.,NAHow did you find the course?,I was very grateful.I mean course I already liked it.I started it previously.But then you were also teaching very good.So I got interested in that.,HighAnd it could back for me.,No sir.,NAOn where is how it came into.,No sir.It was great.,NAThank you very much.,Thank you sir.,NAWhat is your project?,"So my project is vector and ductitation of multiple solutions to the same question.
So we have used Plustering, we have collected code letter and vectorized it using code T5 plus model, then dimensional to reductionist and using human, to avoid cursor dimensionality.
And then different Plustering algorithms has been applied to identify how the Plustering is going to happen.
Right.
This is our real thing.",High"Right.
Thank you.
So why are you using Plustering?","So the Plustering is like when you have different solutions to the same question.
And we don't have any like target variable in our data set.
So that is the first one to be noted.
And there are similar multiple solutions that are correct solutions.
So we expect that all the multiple solutions have a similar pattern actually.
Similar pattern in the sense like they have similar way of answering similar syntax, similar logic.
So when we convert it into a vector space, so all vector space are expected to be together.
So to identify whether they are together and when multiple solutions are combined, is still whether they are still together or they are sparse.
Is what the main objective and why we are using Plustering is like Plustering actually groups the similar things based on the patterns.
So that's why we have used it in the Plustering.",High"Very good.
How do we measure the performance of a Plustering algorithm?","So we have different performance metrics like we used to calculate the quality, compactness and all that.
But in our project we don't have that proof levels.
So we used only Kerenzky-Hargoy's Darius-Boldin and Sillhaut score.
Sillhaut score indicates whether this particular point belongs to this cluster and not to that any other cluster.
Whereas in Kerenzky-Hargoy's, Kerenzky-Hargoy's is the variance of within cluster, ratio within cluster and to the other clusters.
Whereas in Darius-Boldin, the interclass distance and interclass distance between one cluster, we should have less distance.
And on cluster to another cluster, we should have more distance for the compactness like to be very clear.",High"Suppose instead of clustering you are doing classification, would you use the same performance metric or you will change it","Yeah, we will change it.
And moreover, the classification is not suitable for our project titles.
Classification is not a tool that we have to, our project title is not classified or project title is to identify pattern.
Whether it is matched or not.",High"Wonderful.
So you did embedding, right?
Why did you do embedding?","So like when you have a code data, you can't directly feed the TOA model.
Because if you, if I want to train a model, I have to give a point such that the data, such that mission should interpret the data.
So when I give a native vector space, if I point that vector into a vector space, such that my model can visualize the dimensionality and it can train from it.
And directly if I give the code, it means it cannot interpret.
So what we did is we converted into vectors that is mission understandable form, instead of end-dimensional, 256 dimension and the dimension reduction is using Luma.",High"All right.
So now please tell me",Yes,NATell me some of the advantages of this embedding,Yes.,NA"Whatever embedding.
Embedding is a process.",Yes.,NATell me some advantages of embedding and some disadvantages of embedding.,"So first I would like to go with the disadvantages of the embedding.
Like when we have different embedding models.
In particular, we are dealing with codes.
So I would like to talk in the perspective of code only.
Code word, code T5, code T5 plus models are different code embedding.
Some of the code embedding models, where math word is used for math equations or not that thing.
This advantage is like in particular project, what we identified is we do not know exactly how embedding has been created by this particular embedding model.
Means how based on which particular logic or it is creating or based on programming languages that embedding has been generated.
We are at two.
We cannot classify that whether this is done based on this particular thing.
This is done based on this particular thing.
But similar questions are together similar vectors are formed.
But how the vectors have been formed?
We have not greatly explored in that particular area.
And then when you asked about the adorn and one more disadvantage is like when one of our project object to is to identify whether the embedding is a language dependent or language independent.
In our final emphasis, this inference is that it is language independent based on logic only.
It is getting vectorized.
So I would like to say that it is an advantage part based on similar things, respect of different languages.
It is creating a similar vector space, plot in a similar vector space.",High"So let us talk about the disadvantage.
You said that you are not knowing how the embedding is getting formed is a disadvantage.
Is that a disadvantage for the model?
That is disadvantage, your ignorance can be made.","For model it is not a disadvantage.
For our interpretation it is understood.",HighI am asking about the disadvantage of the process,"It means it is creating a dimensional dimensional space.
So that self after creating an dimensional space, like this particular code is represented in a 256 column.
We have to again apply a dimensional detection technique.
I think that might be a disadvantage.",MediumWhich one?,Because it gives us an enlarged dimensionality in which model can't be a computational cost increases,High"So you are saying embedding generates high dimensional vectors, so that is a disadvantage.",And some of the embeddings are two high dimensional elements.,HighNow can you tell me what is an assumption we make while using nav base classifier?,"Nav base classifier, each and every point is assumed that it is true.
It is a nav based.",HighAnd which model is the sequentiality of events?,"You are asking about the bagging or boosting like that.
Boosting uses a sequential process where different models are.
Previous model takes use of output and that output is given as input.",HighSo let us understand that,"And you are asking about stacking regression like that of the model.
That is headcountristic.",High"Let us talk about boosting.
So you said that boosting uses a sequentiality that is output upon model is free to the other model.
How does that happen?","So when you like different boosting or boosting algorithms are there.
In which first we are actually feeding the input to the one particular model.
And then output, that output generated contains some misclassified labels.
So we are feeding that misclassified labels into the next model.
It is that it learns from the previous mistakes and it produces a better result.",High"And you are very excited.
You are feeding only the misclassified labels.",And the sequentiality is complete output to your feed along with the mislabeled information,HighHow is your different from bagging?,"So bagging actually like we have a data set.
We will be treating it and we will be training the parallelism.
It is the parallelism.
We are training different models.
And then at last we are using the voting we are getting the results.
We are using boosting instead of a sequential action where it is a parallel action.
To get a multiple models at range, best result is at it.",High"Okay.
So how do you basically normalize data?","Normalization.
Like let us say you have 100 rows of data in which some of the features are having an outliers.
So we have to normalize outliers.
We have to reduce the outlier range.
So we are using different technique like minmax normalization and Z-score normalization to reduce the outlier range of the outliers.
Whereas in Z-score or robust to the outliers, minmax are sensitive to the outliers.
Z-score cannot remove the complete outlier range but it reduces the range.
Minmax means we are having the specifying the minummon wise boundary.",High"Very good.
Now say you have normalized data.",Yes.,NA"Or else you did not normalize.
There are two scenarios.",Yes.,NA"You did not normalize.
You did not normalize.
You did not normalize.
How will the silhouite coefficient between these two scenarios change?",Silhouite project matrix,NA"You can talk either CHI or DVI or silhouite whichever.
So I have normalization.
Whichever is your favorite.
But you suppose you do not normalize.
How will it change the index?","Minmax did not normalize.
There are outlier points.
So when I plot that outlier point into the vector space, it is completely different.
And then when I particular silhouite score range was, it is like particular to this particular crystal, not to that particular crystal.
Not have completed answer.
Like I can't defend this in this particular scenario.
You have a can't think of that way.",High"No problem.
How did the course go for you?","Yes, that's fine sir.
I feel good.
But little part that I feel is like neural networks and perceptron area.
I didn't understood it well.
That's the only backlog in it I have.
Other things I have at the start.
Neural networks as I know.
But if you ask me anything in this way, I couldn't have answered anything.
That's the fun of the disadvantage that I have in neural networks and perceptron.
Even I got good marks in the video because of that particular section only.
I didn't able to recognize that.",HighWhy did you not come and ask?,"You should have come and ask sir.
But my project area is not in that way and due to the other constant areas, I couldn't able to read it to that particular extent.
I couldn't able to focus.
I mean rest of the things, like from starting part and then last week, discuss some of the topics.
As we have an organization, the cost of damage, which is relevant to my topic and other courses also like data sense and all that.
So I feel it's fine.
Very good.
Come back to that.
Okay.",High"What is your feedback for me?
How can I improve?
For yourself.
I give feedback for you.","Yes.
If it's difficult to ask for me to give feedback to you.
No, I don't work out.",HighYou can give me so that I can improv,"I don't say it as a backlog, but so when last name of Ben students are sitting there, they couldn't able to hear yourself.
That's the one thing I sit for.
I can hear you.
But in first two semesters, I used to sit back.
So when faculties are not saying not that loud, even though I have wanted to listen to the class because I couldn't able to hear.
I generally make attention girls, not to sound that.
I think I address these things in the class many times.
But I think we have to work it on it.
I think because when you're in large class and we have 80 students of student nearly, large students definitely they can't able to hear what you're seeing.",HighSure.,"That's one thing, sir.
That's not the case.
Thank you very much.",HighOkay.,"It's a round.
I have one question.",HighSure,"So next semester, I just not a person.
Not a person.",High"So, is there a specific concept on which you want me to ask you questions?",Like matrix.,NAWhat is the difference matrix which are used for regression?,"For regression, F1 score, accuracy, precision, these are the matrixes for regression.",High"So, we use F1 score, accuracy for regression or classification.","For classification also sir, because while classification we even need to know the model performance.
So, we use the accuracy if for the models performance, we use accuracy, precision took because we should tell if the data which we are pitching is a precise or not like if it is perfect or not.","So, what is regression?","Regression is the, sir it is a method of grouping of grouping data into different, into different sub data sets without knowing its prior information.
Like for example, classification works like if there are five number of vehicles of different companies but different models.
So, we are going to group if it is Toyota, we are going to group the models, all the models related to Toyota company in the one dataset.
And other company vehicles into another dataset that is classification.
But in regression, we do not see like whether it is of this company or what, we will see that if it is a car or not and we divide it into a car or it is a bike or it is a truck like that.",High"So, suppose I am trying to predict the temperature of the day.
What kind of problem is that?","Temperature of the day.
We are taking the input and adding output to the regression, sir.",High"So if I am trying to say whether it is a car or not that is also a regression and if I am predicting temperature that is also a regression.
","No sir.If you are predicting the temperature, I do not know sir, I will be sorry.",MediumIs regression a supervised learning problem or on supervised learning problem?,"It is a supervised learning problem, sir.
Because if there are types in regression, the linear regression and multiple regression and another types.
In linear, we take only x and y that is input and output.
Through that, we are going to sort the data.
That is very simple.
But using the other regression techniques can make our data more efficient and we can fetch our data more efficiently.",High"So let us say that temperature prediction is a problem and you said that is regression.
How will you, let us say you have predicted temperature for 10 days.
How will you find a score for this prediction?
You recall that you said a score is a performance metric for regression, right?
Can you help me understand how will you calculate a score for a temperature prediction which has been done for let us say 10 days?","No sir, I do not know this.
Do not know this.",Medium"Okay.
Now suppose your data is fluctuating too much.
Okay.
From day to day it is very much changing, right?
Yes sir.
Will there be any problem when you are trying to build a regression model?","Yes, it will be a problem.
Suppose when we are trying to fetch the output, suppose on the day one we are going to predict that it is going to be sunny.
But like according to the temperature like other sources it will change.
So the model, the model's accuracy will decrease and the precision will also decrease which also decreases the performance of the model.
And it cannot fetch the exact, like it cannot fetch the exact details of that day.",High"Is there any regression model which takes sequentially of events into consideration?
Sequentially, like what did I predict before is going to affect what time going to predict now?","Yeah.
Asking the type of regression, sir",Low"Yes.
Or the name of a model, which tells this?","Forgot its names like some logistic regression, something it is there, sir.
Like it checks the before predicted value and it will also check the value which we are going to obtain.
It checks both of them so that we are going to get a perfect value of the middle one, the predicted output as well as the output we got after predicted and the exact value.
Yes.
Like that.
I forgot its names as a model's name.",HighNow you have heard of what is called as a decision tree.,"Yes, sir",NAWhat is a decision tree?,"Decision tree.
Suppose it has branches.
For example, we are going to give a loan to a person.
We are going to check his credit score and his income details.
So these are all the branches in a tree.
The total branches, like we cannot predict, but we can tell that if a person want to take a loan, one branch is for his income, one branch is for his credit score, one branch is for his minimum balance and that's all.
So we are going to check whether his income is greater than 50,000 or 80,000.
He can be approved for educational loan or he can be approved for any other loan.
So we are going to set some values.
So in decision tree, through all the branches, we are going to tell if the person is eligible or not.
It is eligible to take these all factors into consideration.",High"That is a decision.
Can you use a decision tree for regression problem?",No.,NA"Suppose you want to build a tree for a regression purpose.
What would it be called as?",Decision tree for regression purpose,Low"Okay, let's talk about decision tree.
What is the effect of normalizing data on decision tree?","The effect of normalizing data.
So like in what terms, sir?",HighI didn't understand your question,"In what terms, it can be normalized, sir.",Medium"You know what is data normalization, sir?","Yes, sir.",NAWhat is it?,"Sir, like we are going to sort the data based on the data we have.
Like we are going to, how should I say it, sir?
I am not getting into say it, sir.",High"No problem.
Any questions for me?",nothing,NAHow did the course move for you?,"Very good, sir.
Very well.",LowAny feedback for my improvement,"Very good.
You are teaching me everything is good, sir.",Medium"Okay.
Thank you very much.","Thank you, sir.",NA"Do all the character classes have same number of samples in their dataset?
You have different characters, for example your training right?",Yes,NA,,"Do all the characters have same number of characters, samples?
On the character scene?",No sir.,NA"They have different number of some different ones.
So is that a class balanced problem or a class imbalance problem?
Balance or problem sir?",It is a class balanced set.,Medium"Classes are balanced.
When they are not same.
Then what is class imbalance problem?","Accuracy.
So for the balance set we use, I'll accuracy once.",High"But my question is when the number of samples present in your dataset vary from one class to another too much, is that a class balanced set or a class imbalance set?
So when it varies it is an imbalance set.","Is that your problem?
Is that the same thing you are experiencing in your project?
But no sir.
Like we have extracted the guber features and we fed in the HMO model.
But we are predicting the character is predicting but it is predicting the wrong character like it is randomly taking from the training dataset.
Can ",MediumCan you tell me what is the full form of HMOWhat is the work of model?,"There are various components in the states.
Then the initial probability matrix moves the transition matrix.
So these are the components.",High"What is transition matrix?
So what is initial probability?",So like it will be given the matrix and the rows will be like a dimension that filled with 0.,High"But it is filled with 0 that is initial probability.
Marks you up.
So let us say you have trained your HMM.
How will you measure how good the HMM is?
What are the performance matrix used for classification?
Performance matrix.
The distance matrix.","Equally distance, man hat and distance.
Can you write the formula for equilibrium distance in n dimensional space?
Equally.
Okay.",Medium"Are you missing something there?
1 by n. 1 by n. What is n?","The n dimensional space.
So you divide it by 1 by n. You will get an distance.
So like only XM and Sway are going to go.",HighDo you put a 1 by n?,Let it not there,LowHow did the course go for you?,"Like machine learning I learnt it very good sir.
Like they understood how the machine learns and all.
Actually it is a loop for me.
It is a good experience like learning and seeing.
Like we are training the machine.
We are learning like making the machine understand Ganga Timur.",HighCan you give some feedback for my improvement?,"For all things I didn't do good in that class.
Can you point out?
It is not like that sir.
But for me, the explanation part I am just for sir.
But for me when it is visualized I can understand a bit.
It is clear sir now.
But for me if it is visualized then I will be remembering.
No I don't.
But the explanation is for remembering.
But if it is visualized then it will be easy for me.
On this way.",MediumThank you very much.,"166th.
Thank you.",NA" Okay, so how have you been prepared for VIVA ?","Sir, I have gone through most of the topics and mainly gone through the topics before the medicine.",HighOkay.And your project is on what?,Weighted regression. Code evalution,Medium"Okay, very good So, which of the regression models you have used?","Sir, we have used XG Boost, Cod Boost, Adah, Boost and then random forest and then we also tried stacking",HighStacking.,"Stacking with, with end point regression, Scad.",Medium