teacher ,student,fluency You ask me a question.,So what is classification?,Medium"What is classification?
That is the best question you can ask.
The depth of question you are asking, reveals how much you have understood.
That is one mark you get.
Not one mark that goes into it.",It would be one.,MediumThat is the best question you can ask.,More I should ask you,Medium"Okay, which module is prepared well?",classification KNN.,MediumWhat is there to prepare in KNN?,So it is the first thing I read,MediumSo please tell me whether KNN is a linear classifier or non-linear classifier?,"So it is linear.
Because it is a super-wise learning technique.
We are assigning labels.
See, we have one variable.
We have other variables which have data.
So based on those, we are finding the distance to those.
We are assigning the labels of those variables to the one that we have.
The number of since it is K and N, closest number of labels, label where are they
But we have to find distance to all of them.So it is linear.
Because it is a super-wise learning technique.
",MediumSo how does that make it a linear classifier?,As we dealing with non-linear data,Medium"But I am not talking about data linearity, right?",,I am talking about classifier linearity.,,What is a linear classifier?,…....(NA),NA"These are super-wise learning, right?",….......(NA),NAWhy do you say it is a super-wise learning technique?,Because we are dealing with label data,MediumWe are dealing with label data.,,"And because it is labeled, so it is super-wise.",Yes.,NA"Okay, why?",,Why is super-wise and with label data?,"We are just, because we are assigning something that is already available.
We are not coming up with anything new.
",HighOkay.,,What are the performance metrics which can be applied for KNN classifier?,"precision , accuracy  recall , f1-score",Highwhat is Beta score,"Beta score
We have some importance.
We need to give equal importance to precision and recall
Then, you should use f 1 score with then
Beta  has one value.
So by default the value is 1.
But then when it has a different value, it becomes beta-score.
And then there's that formula for calculating",Medium"So you said when we give equal importance, beta becomes 1.",Yeah.,Medium"OK, when it decreases.",I don't know,Low"OK. You said precision and recall.
What do theymean ? Can you explain","The one is like the actual positives that are there by the total predicted positives.
And the other is the correctly predicted positives by all the positives that are there.
So this true positive, false positive, true negative, false negative is there.
So so this false negative is actually something that is positive.
And true negative is, yeah, false negative is actually something that's positive.
So we're calculating based on that.
So if you ask exactly, then precision will be true positive by true positive plus false negative.
The other one will be true positive, by true positive plus false positive.
Basically, we're checking ratios of the positivity, which we predicted by total positives and 
correct positives",Medium"What if it is a multi-class scenario?
OK. How do we carry out dimensionality reduction","PCA, TSNE, .",Medium"So, why do we do the dimensionality reduction of it?",So that we can reduce the computation but keep relevant features,HighDo they help the model?,Yes.,NA"So, you said PCA can be used for dimensional data","All three of them.
PCA, TSNE and …",MediumThen I am going to ask all three,I don't know in detail on each one.,High"So, you did PCA and it helped","So we used it in the project and so it helped
 all three.
So, it reduced dimensionality that's all.
So, we were in getting good accuracy but once we did all these three, it  gave good accuracy",MediumYour thing is regression from.,"R square, our thing  is  regression.",MediumAnd what are the metric you are using for regression?,"R square, mean absolute error, mean square, root mean square, mean percent age",High"What is the different between R square, score and that's mean absolute error","So, mean absolute error is just the difference between like the summation of 
differences between actual value minus predictive value by total number of values.
R square, we are checking something else.
So, that when it is, it ranges between 0 and 1, 1 being perfect fit.",High"Okay, is higher R square good or bad?","So, it's between 0 and 1.
And so, higher will be good.
One is the perfect fit",MediumWhat about mean absolute error?,…...(NA),NA"Mean absolute error, what kind of range of values it can take?",Sir lesser the better,Medium"Yeah, but what is the range of values it can take?",we can use..,Lowso it can take 0,If thre is no difference between natural and predicted then yeah.,High"In mean absolute error, do you have a denominator?","So, for that it should be equal to the denominator itself.
Yes, we divided by the number of values that are there",HighCan it have 1000?,yeah,NAMinus 5.,no sir only  Positive values.,Medium"So, is there a range of values mean absolute error can take?",It can't have negative value.Sure,HighPositive values it can take.,"So, in the program by some error it was coming but according to what I have learned now.
Like we are doing the projectSo, in the program by some error it was coming but according to what I have learned now.
Like we are doing the project",Medium"So, what about R square","Yeah, in this hackathon also it came sir",Medium"So, it is coming right?","yeah, ",NA"So, you are saying there is a bug in the code.",yes sir,NAThat is right is coming.,yes sir,NAAnd there is no mathematical explanation for it,no sir,NA"So, you are saying there is a bug in the code.
And there is no mathematical explanation for it",…..,What can I do to make it better,nothing sir,NAany feedback for  me,"I mean, you don’t bully like other teachers.",MediumThank you very much.,Thank you sir.,NA"Did you have breakfast?
Why not?
you woke up late ?
Can you please close the door?
Thank you.
How have you prepared for the viva?","no sir , I woke up late . I prepared K-NN classification and linear regression .",HighWhat is your project?,Stacking models of clustering.,Mediumwhat is your role no,"170 , sir",NA"so , You have prepared K-NM and linear regression.
What is the diffrence between them?","K-NM classification.
We will find the nearest neighbouring value 
In linear regression, it will find the dependent independent variables.
In linear regression, we will try to find the best fit line.",Medium"In linear regression, you will find the best fit line",We say that... ... ...it will change that the dependent independent variables are dependent or not.,Medium,,Why should you find this line? How do you find this line?,By finding the mean... ...sum square method... ...then mean,Medium,We will check from the sum square method and two more are there sir.,High,,sum square method and mean.,Root mean... ...mean absolute.,Low,,"So, let's say you have found the line.
How will you measure... ...how well this line is fitting to your dataset?
Do you have some measures to find out whether it is a good fit or a bad fit?
","Mean square error , Root mean , Sum Square mean ",High"Yes, root.",to find out approximately value.,Highokay,…......,NA"So, where do you have square error? Why",it will give the big value,HighBut why square?,na,NA"Suppose you don't do squaring, what will happen?",…......na,NA"You will give a big value for what reason , I'm asking.","So, squaring only we are creating our big value.","So, are you saying that if you don't square, it will give a big value.",sorry sir,NAIs that what you are saying?,,"So, by squaring, we are making it a small value.",no,NA"By squaring, you are getting a big value.And why do you need a big value?","I know but , yes sir . In the f1-score, min max, normalization.",Mediumno problem,,You know what is data impultation?,no sir,NADo you know what are outliers?,no sir,NA"Now, suppose you have lot of features which are available
Is that a good thing or it is a bad thing?",Good thing only sir,HighGood thing,,good sir Is it always good?,No sir.,NA"So, it is conditionally good.",yes sir,NAso when is it good and or not good ,According to situations,Highcan give an example of a situation where it is not good?,…....no sir,Low"No problem.
I think you are not having breakfast is affecting your thinking process.
Okay.
That is fine.",…....,NAHow did the course go for you?,It was good.,MediumOkay.,,any  feedback for me,good teaching sir we learn from it,Mediumhow can I improve ,it is sufficient for me ,Mediumcould  I have donr anything better,Whatever I completed from 5 semesters.this I learnt very well,Mediumokay ,ok sir,NA"So please participate in outside hackathons and more.
Because only if you do it, only if you practice you will learn more.
And you will be better prepared to face your campus placement  and get a better job and all that..",ok sir,NA,,Thank you very much.,thank you sir,NA,, you didn't take your initial phase of project also.,"Yes sir, that medical report when I told that she told that you can write a letter and to sir
 give to sir but she can't take the medical report because it's already been you should have been given that fourth or fifth only.",HighWhy you didn't give it during that time?,"I came but i dont know 
for a attendance shortage it was that she told that there will be no attention
to attendance shortage.",High"Okay, what are you prepared for, viva?",sir i have prepared from Everything.,Mediumevrything?,Not from everything but look some some point up there.,MediumSo tell me where I should ask you questions from?,"knn , random forest , clustering , k clustering",High"Okay, let's take one after another.",no sir…,NASo tell me what is random forest?,First we will take a random value then we will make a subset of values and and and from that decision,HighYou have made so many different trees?, trees is made and so many different trees like a classic forest.,Medium"So finally how would you arrive at a class value?
When the input data is given to your random forest
because so many trees are there, each tree will generate one output right?
So how will you come to one output, single output from all these trees?
So you give one input vector to random forest.
Will you give one output or multiple outputs?",one,NASo my question is from multiple trees how will you arrive at a single output,Multiple values.,NACorrect.,,In random forest what do you nearest?,it is KNN,LowCorrect.,,You want to refer to your notes and answer this question?,"I don’t  Know  , I have not studied  Sir that will not be viva.",Medium,,That is for me to decide right?,How can It be?,MediumOkay you refer to your notes and answer.,hmm,NAWhat is common output?,So we get one output for each one which carries the common outputs.,MediumYou will take that as the final output.,Which comes more like which values come more?,MediumHow will you measure whether this model is a good or not?,"classification we use F1 score, R square ahh.. Recall , accuracy ",Mediumwhat is R square,R square …..,LowYou don't know,no sir ,NAwhat is recall,recall based on that false positive negative …....,LowCan you write the formula ,"recall , …. Hm false positive by…",LowAre you asking me?,no sir,NAWhat is the difference between the recall and precision?,recall… ahh ,LowWhat do precision and recall measure?,Performance,NA"Both are measuring performance, your formula is wrong","how  presicse , its based on the table , true positive and negative ",Medium"Can you draw confusion matrix, the table for a multi-class scenario?
Is this multi-class scenario?",no,NAok ,,So how did the course go for you?,good only sir ,Medium,I studied sir but I don't know how to  explain  it or tell ,MediumWhy do you do not approach me and ask these questions?,"Sir, I tried to study myself.",Mediumany feed back  for me ,no sir ,NAthank you very much ,thank you sir,NAdid you have break fast ,sir ?,NAdid you have break fast ,"yea sir , yea yea ",Low"Okay, whatever you prepared well for the Viva?","Regression,  basically regression.",Low"Yes, what is your project?","Project is like impact of non-code text evaluation.
Like basically project is like code and question and comment etc.
We are predicting like which column has more impact on the final marks.",MediumHow do you measure the performance of a regression?,"Performance matrix was the regression in general, it means square error, mean absolute error, absolute mean error and R square.",HighYou can write the formula for RMSC,writes it down,NAWhat is this?,this the predicted value,MediumSo what is the range of values RMSC?,"Like it dont have specific range basically it would be 0 to 1.
Basically, if you are here, 0.0.
if you have less ah ah 
It would be good.ah
It performs or model perform better",Medium"So, RMS can be taking an negative value.","No, not sir.Its only positive ",Medium"So, how do you know which value is a good value . to attend in your RMSC for a model?","Like, I use a performance matrix or like this one sir.
Like, how we can know that it is like, as far as I know, like, less ",Medium"So, less means how much?","Basically, less means like, in our models, like, we got like, zero, like, one model is used, like, like, basically, we compare it with other models.
One model is used, like, zero point seven as a relic and one model, like, zero point six.
We can say, like, this model, like, this model is in model, we can say, this model is, like, for a long better that this, like, not only, like, a commission is
but considering the R square value, like, other, other errors. So, we can compare with other models, like, we cannot say",Mediumis there a relationship between MSC and R square?,"no sir, like, ah, this is the, like, this is a MSC, this is a MSC, we should compare the, 
like, only MSC's of both models, we should not compare, like, I guess, like, yeah, how we
can, like, say, this is better, like, by comparing the other models, like, independently
like, less or the, like, you should be, like, or put the performing model, like, by
considering the, like, other parameter, R square, MSC, all others.",Medium,,"So, suppose you are normalizing the data values?","moreover, like, basically, obviously, like, basically, we, we are making our data, like,
zero to one, like, between the zero to one, no problem, you are not, you are not, like, not 
normalizing, basically, we are, like, like, ah, like, ah, we are, like, we are, just doing 
the embeddings, like, we get the other values, like, ah, like, like, minus, like, one to,
like, plus one, all the values.
Ah, I guess, like, it doesn't have much impact",MediumWhy you would say that?,"Ah, like, ah, like, it depends on embeddings, like, if we, like, embeddings, like, 
embeddings, like, you know, project, like, ah, like, by performing, like, one time, we got
one embeddings, one time, we got different, by, like, by doing the results with the, like
different embeddings, we got almost, like, same, like, same results.",Medium"So, suppose I am taking the embeddings which you have generated, and multiplying them by 100
then my scale increases?
will rmsc increase 100 times 
You know, the formula
based on the formula, why don't you tell me it will increase or not?","Ah, I guess it will increase, but not, like, that much compared to, like, general",MediumWhere do you see in the formula that it will increase.,"yea sir , according to formula it will increase
Well, like, this is the x value, like, both will cancel out, I guess, like, this is 
actually the predicted, both will cancel out and, you know, same, like, I, like, listen,
like, ah, this is the, like, if we, even the English, the, like, difference would be same,
so, it would be, ah, remember the same, like, almost same.",Medium,, you have given me three answers in last.,This is the final answer.,Medium,,What will you do if you have categorical values in your data?,"We can, ah, we can do, like, according to the, like, data, like, if he has, like, ardinal 
data, like, we can do the, ah, one, ah, a dip on encoding, like, we have, like, like, if
has frequency, basically, we have no one, like, generally, we can do  encoding, like
basically, you are putting the, categorical coordinates to, like, numbers, and we can do encoding.
If you have a particle, or we can take, ah, the, like, ah, which is more repeating, more, like, imputation.",Medium"So, you can do imputation to deal with categorical?","No, no, sir.Yeah, yeah, mean, replacing with, ah, mean, and one of which mean.",Medium"Why are you replacing data with it, mean?How does it help you?","if we, this, like, if it doesn't have, like, ah, irreverent, or, like, ah, does it have any impact to our data, I said, we'll remove that.
Otherwise, ah, best thing is, like, we add the, like, ah, we'll replace with that, mean
ah, or medium, like, which has, ah, that's, basically, generally, we did before, performing
the, and, ah, missing, actually, the missing values ",MediumHow did the course go for you?,"Ah, yes, sir, well, other teacher where dealing with ppt.you explained it on board like ah",High,,any feedback for me,everything was good expect for voice ,Mediumthank you very much ,thank you sir,NAdid you have breakfast ,no sir ,NA"No, why not?",,Tense,yes sir ,NAI will ask questions from what you have prepared.,"Sir, up to regression linear regression.",Medium"Up to linear regression, yes.",,Okay.,,"So, tell me what is linear regression?","It is usual for the numerical target labels like which are continuous and discrete values, which does not have any label like doc at like that.
It is depends on whether condition like if you want to find the weather, what is the weather condition today by using temperature?
We will use linear regression like y is equal to mx plus c like that and x will be the temperature,
 y will be the predicted weather and x will be the what is temperature of before day or something like that and we will use that",High"So, you talked about m and c. Yes.What are they?","Like when training we will get one lines by using the points which is suited for the model which has less accuracy from that.
For that plane what is the slope is called m and what is the intercept is called a.",HighWhat do they do for us?M and c.,Which is used for getting the line for the models,Medium,,"So, what does c do for the line?",Intercept like when x equal to 0 what is the height of the line from that point to Y,High,,"Yeah, but suppose let us say m as a small value versus large value.
How does the line get affected by it?","M is small value.
If m is small value the line will be till down like the line will be till down and the error 
will be increase like points is like this and we have got one line by slope.
If you decrease the slope then it will go down and the points will be where here up of the line 
 then error will be increases like we will find the mean square error like that number.
Sir, from that we will calculate the error from the line to that points and it will be increases then it will not fit for the model.",HighVery good.,,"Similarly, what is your explanation for c?",I think it will shift the line based on the x axis.,Medium You said m and c right?,It will tilt the line like this and the line position of the line moving frontward or backward will be depends on this I think,High,,Very good.,,That is right.,,So are m and c parameters or hyper parameters?,Hyper parameters. Parameters sir In the training section we will find the m and c ,HighSo they are parameters.,Yes.,NACan you name one hyper parameter for linear regression?,Hyper parameter…ah.Like for finding m and c we will find inside the training section,MediumOkay.,,Very good.,,So let us say you have built a linear regression.,yes sir,NAHow would you measure how would this regression ,"In the main thing will be I think r squares score , other things will be there like mean square error.
MAP, absolute error, mean square error, root mean square error.
Like how they will depend is like when you take points according to like distance of if points are increased,
training set will be increases, error will be increases because we are taking the root mean square summing of the points.
Then the error will be increases.
So we will take r square score.",HighWhat does r square score mean?,"Like it will be based on the RSS by TSS which depends on the predicted value and the actual value.
By taking the fraction of that like it will depend on the points like how many training data sets like that.
Like if the point is so far then I think there is condition where it will it is 1 minus RSS by TSS.
So if is point is so far then there is some points so far there is some condition like 1 minus will goes down to the 0.
Because of RSS and TSS value increases more than one fraction of that.
So it will goes down to the 0 and if it is nearer to the 1 or 1 it will be very good model for us.",HighCan r square value be negative?,Yes sir.,NAGood.,,You have studied very well.,,Any feedback for me,"Like hackathon thing is very good sir and the thing which you have uploaded how to like I do not know before how to upload in the GitHub like that.
I know how to load in GitHub that thing and quizzes are very good.
Like first quiz was very good.
Which like I taught all all our multi choice but a summer multi choice and it is very difficult thing and I like the whole thing.",HighIt is challenging you.,yes sir,NAThank you very much.,Thank you sir.,NARoll number is 173.,Yes sir.,NAwhat have you prepared,"So, i am prepared from the starting till neural networks then kind of know about bagging, boosting and…",Medium,,"Okay, tell me what's the difference between bagging and boosting?","So like for boosting it's like we get multiple set of... i mean
There will be many values and based on features of it... Based on classification .. Based on
Knowing the features of it, it clubs into...
It clubs together and forms a main design.
And as for a bagging it's like there will be a main data set which gets segregated into
Separate features.",Medium,,Separate features ?,Like if it's... sir can i say with example ,Medium,,Yes.,"Okay, so if there's a given set of data sets, then if there's some height...
If the data set is above height, So students below 30...
I mean students below  130 cm will be like that.
And above 130...
Between something like that is…",MediumOkay.,,Alright.,,,,That is the difference between bagging and boosting.,,Okay.,,,,Can you name on bagging classifier?,"ahh.. I think ,Xg boost is there adaboost",Medium,,Can you tell me how the trees are constructed in adaboost?,"Yes sir.
So basically there will be many... ...values.
So based on what are requirements, it gets formed to...
It gets formed to... ...small club... ...club categories.
Then from there, it takes again the... ...common features.
I mean the classifier...
...I mean categories, then like that it comes from... ...it approaches like... ...as a single.",Low,,"So what are the different performance metrics which are used for 
lets say boosting classifier?",don’t know sir,NAWhat is your project?,It's to understand the relevance of boosting for a given algorithm.,High,,Is that a... ...classification problem or a regression?,A regression?,Medium,,Why is it a regression problem?,"Because... Because you are trying to... ...predict some values instead of classifying... ...the what kind of question is it?
You are trying to predict those.",MediumWhat are the performance metrics which you have used in your project?,…...........,NA,,Can you tell me what is the difference between mean and median?,"So mean means the values... ...by the total number of... ...numbers in a given set.
The mean means the middle most value now.
The identity.",Medium,,Can you write the formula for mean?,Yes.,NACan you write the formula for you Euclidean distance?,Yes.,NACan you write it in N dimensional space not into 2D?,.....sir,NA,,sorry what is can you can you read out the read it out?,x whole root of x2 minus whole 1 by r,High,, is that for you have a Euclidean distance?,…....,NA,,how did the course go for you?,it was good,Medium,,why do you say it was good ?,"sir, because it is a new subject and it is better to know , from past 5 to 10 years this course has been so like top ",High,,anyfeedback for me ,,,no sir,NAthank you ,thank you ,NA"So, what have you studied well.","So, I am confident about classification, cluster, regression, random forest decision tree.",Highwhat  is a  difference between decision tree and random forest.,"Sir, so, decision tree, random forest is basically a collection of decision trees.
Random forest contains many decision trees and each decision tree is given a subset of the training data, .
each predicts an output and the average of these outputs is taken as the output of the random forest",Highaverage is taken.,"Yes sir . No, sir the best predicted  output is taken.",Medium,,What is best predicted out?,"So, like each tree predicts an output to the one with the least error.",MediumOne with least error.,,"So, when it predicts it also tells you how much error it is making it.","No, sir.",NAthen?,no sir combining the output….(scared),Loware you getting tense?,Yes sir.,NAAm I asking difficult questions?,"No, sir no.",Low,,What did your friends tell you? I am creating problems.,"No, sir.They were like, sir is very good.",Medium"Then why are you getting tense?
Okay, relax.
You didn't have breakfast, so lunch time already, so maybe you are hungry.
So, let's come back.",(silence),NA"So, continue with random forest.","One second, sir.",Low,,